------[ AIDA64 v4.00.2726 Beta ]------

------[ Microsoft Windows 8.1 Enterprise 6.3.9600.16452 (64-bit) ]------

------[ Motherboard Info ]------

Motherboard ID      : <DMI>
Motherboard Model   : ASUSTeK COMPUTER INC. UX301LAA
Motherboard Chipset : Intel Lynx Point-LP

DMI MB Manufacturer : ASUSTeK COMPUTER INC.
DMI MB Product      : UX301LAA
DMI MB Version      : 1.0
DMI MB Serial       : BSN12345678901234567
DMI SYS Manufacturer: ASUSTeK COMPUTER INC.
DMI SYS Product     : UX301LAA
DMI SYS Version     : 1.0
DMI SYS Serial      : D9N0CY012087360
DMI BIOS Version    : UX301LAA.204

------[ PCI Devices ]------

B00-D00-F00 [8086-0A0C] [1043-13BD] [CC0600]: Intel Haswell-ULT - Mini HD Audio Controller [C-0]
B00-D02-F00 [8086-0A2E] [1043-13BD] [CC0300]: Intel Haswell-ULT GT3 - Integrated Graphics Controller [C-0]
B00-D03-F00 [8086-0A0C] [8086-2010] [CC0403]: Intel Haswell-ULT - Mini HD Audio Controller [C-0]
B00-D04-F00 [8086-0A03] [8086-2010] [CC1180]: Intel Haswell-ULT - Dynamic Platform & Thermal Framework Processor Participant [C-0]
B00-D14-F00 [8086-9C31] [1043-201F] [CC0C03]: Intel Lynx Point-LP PCH - USB 3.0 xHCI Host Controller
B00-D16-F00 [8086-9C3A] [1043-13BD] [CC0780]: Intel Lynx Point-LP PCH - Host Embedded Controller Interface 1 (HECI1)
B00-D1B-F00 [8086-9C20] [1043-13BD] [CC0403]: Intel Lynx Point-LP PCH - High Definition Audio Controller
B00-D1C-F00 [8086-9C10] [0000-0000] [CC0604]: Intel Lynx Point-LP PCH - PCI Express Root Port 1
B00-D1C-F03 [8086-9C16] [0000-0000] [CC0604]: Intel Lynx Point-LP PCH - PCI Express Root Port 4
B00-D1F-F00 [8086-9C43] [1043-13BD] [CC0601]: Intel Lynx Point-LP (Premium) - LPC Controller
B00-D1F-F02 [8086-282A] [1043-13BD] [CC0104]: Intel 82801HB(M) ICH8(M) - SATA RAID Controller
B00-D1F-F03 [8086-9C22] [1043-13BD] [CC0C05]: Intel Lynx Point-LP PCH - SMBus Controller
B00-D1F-F06 [8086-9C24] [1043-13BD] [CC1180]: Intel Lynx Point-LP PCH - Thermal Controller
B02-D00-F00 [8086-08B1] [8086-C070] [CC0280]: Intel Dual Band Wireless-AC 7260 AC 2x2 HMC WiFi Adapter

B00 D00 F00: Intel Haswell-ULT - Mini HD Audio Controller [C-0]

  Offset 000:  86 80 0C 0A  06 00 90 20  09 00 00 06  00 00 00 00 
  Offset 010:  00 00 00 00  00 00 00 00  00 00 00 00  00 00 00 00 
  Offset 020:  00 00 00 00  00 00 00 00  00 00 00 00  43 10 BD 13 
  Offset 030:  00 00 00 00  E0 00 00 00  00 00 00 00  00 00 00 00 
  Offset 040:  01 90 D1 FE  00 00 00 00  01 00 D1 FE  00 00 00 00 
  Offset 050:  41 02 00 00  B1 00 00 00  17 00 D0 DF  01 00 00 CF 
  Offset 060:  05 00 00 F8  00 00 00 00  01 80 D1 FE  00 00 00 00 
  Offset 070:  00 00 00 FF  01 00 00 00  00 0C 00 FF  7F 00 00 00 
  Offset 080:  10 00 00 00  00 11 11 00  1A 00 00 00  00 00 00 00 
  Offset 090:  01 00 00 FF  01 00 00 00  01 00 10 1F  02 00 00 00 
  Offset 0A0:  01 00 00 00  02 00 00 00  01 00 20 1F  02 00 00 00 
  Offset 0B0:  01 00 E0 CF  01 00 C0 CF  01 00 00 CF  01 00 E0 DF 
  Offset 0C0:  00 00 00 00  00 00 00 00  00 00 00 00  00 00 00 00 
  Offset 0D0:  00 00 00 00  00 00 00 00  00 00 00 00  00 00 00 00 
  Offset 0E0:  09 00 0C 01  99 63 00 72  D0 00 5B 76  00 00 00 00 
  Offset 0F0:  00 00 00 00  C8 0F 01 00  00 00 00 00  00 00 00 00 

B00 D02 F00: Intel Haswell-ULT GT3 - Integrated Graphics Controller [C-0]

  Offset 000:  86 80 2E 0A  07 04 90 00  09 00 00 03  00 00 00 00 
  Offset 010:  04 00 80 F7  00 00 00 00  0C 00 00 E0  00 00 00 00 
  Offset 020:  01 F0 00 00  00 00 00 00  00 00 00 00  43 10 BD 13 
  Offset 030:  00 00 00 00  90 00 00 00  00 00 00 00  00 01 00 00 
  Offset 040:  09 00 0C 01  99 63 00 72  D0 00 5B 76  00 00 00 00 
  Offset 050:  41 02 00 00  B1 00 00 00  00 00 00 00  01 00 E0 CF 
  Offset 060:  00 00 02 00  00 00 00 00  00 00 00 00  00 00 00 00 
  Offset 070:  00 00 00 00  00 00 00 00  00 00 00 00  00 00 00 00 
  Offset 080:  00 00 00 00  00 00 00 00  00 00 00 00  00 00 00 00 
  Offset 090:  05 D0 01 00  D8 01 E0 FE  00 00 00 00  00 00 00 00 
  Offset 0A0:  00 00 00 00  13 00 06 03  00 00 00 00  00 00 00 00 
  Offset 0B0:  00 00 00 00  00 00 00 00  00 00 00 00  00 00 00 00 
  Offset 0C0:  00 00 00 00  00 00 00 00  00 00 00 00  00 00 00 00 
  Offset 0D0:  01 A4 22 00  00 00 00 00  00 00 00 00  00 00 00 00 
  Offset 0E0:  00 00 00 00  00 00 00 00  00 80 00 00  00 00 00 00 
  Offset 0F0:  00 00 00 00  00 00 00 00  00 00 09 00  18 A0 AF CE 

B00 D03 F00: Intel Haswell-ULT - Mini HD Audio Controller [C-0]

  Offset 000:  86 80 0C 0A  06 00 10 00  09 00 03 04  10 00 00 00 
  Offset 010:  04 C0 D1 F7  00 00 00 00  00 00 00 00  00 00 00 00 
  Offset 020:  00 00 00 00  00 00 00 00  00 00 00 00  86 80 10 20 
  Offset 030:  00 00 00 00  50 00 00 00  00 00 00 00  10 01 00 00 
  Offset 040:  00 00 00 00  99 63 00 72  D0 00 5B 76  B1 00 00 00 
  Offset 050:  01 60 02 00  00 00 00 00  00 00 00 00  00 00 00 00 
  Offset 060:  05 70 00 00  00 00 00 00  00 00 00 00  00 00 00 00 
  Offset 070:  10 00 91 00  C0 0F 00 10  00 08 00 00  00 00 00 00 
  Offset 080:  00 00 00 00  00 00 00 00  00 00 00 00  00 00 00 00 
  Offset 090:  00 00 00 00  00 00 00 00  00 00 00 00  00 00 00 00 
  Offset 0A0:  00 00 00 00  00 00 00 00  00 00 00 00  00 00 00 00 
  Offset 0B0:  00 00 00 00  00 00 00 00  00 00 00 00  00 00 00 00 
  Offset 0C0:  00 00 00 00  00 00 00 00  00 00 00 00  00 00 00 00 
  Offset 0D0:  00 00 00 00  00 00 00 00  00 00 00 00  00 00 00 00 
  Offset 0E0:  00 00 00 00  00 00 00 00  00 00 00 00  00 00 00 00 
  Offset 0F0:  00 00 00 00  00 00 00 00  00 00 00 00  00 00 00 00 

B00 D04 F00: Intel Haswell-ULT - Dynamic Platform & Thermal Framework Processor Participant [C-0]

  Offset 000:  86 80 03 0A  06 00 90 00  09 00 80 11  00 00 00 00 
  Offset 010:  04 00 D1 F7  00 00 00 00  00 00 00 00  00 00 00 00 
  Offset 020:  00 00 00 00  00 00 00 00  00 00 00 00  86 80 10 20 
  Offset 030:  00 00 00 00  90 00 00 00  00 00 00 00  10 01 00 00 
  Offset 040:  00 00 00 00  00 00 00 00  00 00 00 00  00 00 00 00 
  Offset 050:  00 00 00 00  B1 00 00 00  00 00 00 00  00 00 00 00 
  Offset 060:  00 00 00 00  00 00 00 00  00 00 00 00  00 00 00 00 
  Offset 070:  00 00 00 00  00 00 00 00  00 00 00 00  00 00 00 00 
  Offset 080:  00 00 00 00  00 00 00 00  00 00 00 00  00 00 00 00 
  Offset 090:  05 D0 00 00  00 00 00 00  00 00 00 00  00 00 00 00 
  Offset 0A0:  00 00 00 00  00 00 00 00  00 00 00 00  00 00 00 00 
  Offset 0B0:  00 00 00 00  00 00 00 00  00 00 00 00  00 00 00 00 
  Offset 0C0:  00 00 00 00  00 00 00 00  00 00 00 00  00 00 00 00 
  Offset 0D0:  01 E0 03 00  08 00 00 00  00 00 00 00  00 00 00 00 
  Offset 0E0:  09 00 0C 01  99 63 00 72  D0 00 5B 76  00 00 00 00 
  Offset 0F0:  00 00 00 00  00 00 00 00  00 00 00 00  00 00 00 00 

B00 D14 F00: Intel Lynx Point-LP PCH - USB 3.0 xHCI Host Controller

  Offset 000:  86 80 31 9C  06 04 90 02  04 30 03 0C  00 00 00 00 
  Offset 010:  04 00 D0 F7  00 00 00 00  00 00 00 00  00 00 00 00 
  Offset 020:  00 00 00 00  00 00 00 00  00 00 00 00  43 10 1F 20 
  Offset 030:  00 00 00 00  70 00 00 00  00 00 00 00  00 01 00 00 
  Offset 040:  FD 01 06 80  89 C6 0F 80  00 00 00 00  00 00 00 00 
  Offset 050:  5F 2E CE 0F  00 00 00 00  00 00 00 00  00 00 00 00 
  Offset 060:  30 20 00 00  00 00 00 00  00 00 00 00  00 00 00 00 
  Offset 070:  01 80 C2 C1  08 00 00 00  00 00 00 00  00 00 00 00 
  Offset 080:  05 00 B7 00  F8 01 E0 FE  00 00 00 00  00 00 00 00 
  Offset 090:  00 00 00 00  00 00 00 00  00 00 00 00  00 00 00 00 
  Offset 0A0:  00 01 04 00  00 00 00 00  00 00 00 00  00 00 00 00 
  Offset 0B0:  0F 00 03 00  00 00 00 00  00 00 00 00  00 00 00 00 
  Offset 0C0:  00 00 00 00  00 00 00 00  00 00 00 00  00 00 00 00 
  Offset 0D0:  FF 01 00 00  FF 01 00 00  0F 00 00 00  0F 00 00 00 
  Offset 0E0:  00 08 00 00  00 00 00 00  00 00 00 00  D8 D8 00 00 
  Offset 0F0:  00 00 00 00  00 00 00 00  B1 0F 04 08  00 00 00 00 

B00 D16 F00: Intel Lynx Point-LP PCH - Host Embedded Controller Interface 1 (HECI1)

  Offset 000:  86 80 3A 9C  06 04 10 00  04 00 80 07  00 00 80 00 
  Offset 010:  04 40 D2 F7  00 00 00 00  00 00 00 00  00 00 00 00 
  Offset 020:  00 00 00 00  00 00 00 00  00 00 00 00  43 10 BD 13 
  Offset 030:  00 00 00 00  50 00 00 00  00 00 00 00  00 01 00 00 
  Offset 040:  45 02 00 1E  10 00 01 80  06 23 00 60  F0 1F 00 10 
  Offset 050:  01 8C 03 C8  08 00 00 00  00 00 00 00  00 00 00 00 
  Offset 060:  00 02 00 00  00 44 00 00  00 00 00 00  10 00 00 40 
  Offset 070:  00 00 00 00  00 00 00 00  00 00 00 00  00 00 00 00 
  Offset 080:  00 00 00 00  00 00 00 00  00 00 00 00  05 00 81 00 
  Offset 090:  F8 02 E0 FE  00 00 00 00  00 00 00 00  00 00 00 00 
  Offset 0A0:  00 00 00 00  00 00 00 00  00 00 00 00  00 00 00 00 
  Offset 0B0:  00 00 00 00  00 00 00 00  00 00 00 00  02 00 00 C0 
  Offset 0C0:  50 73 BC 61  DE 62 A8 34  29 3A 67 D3  3D 76 17 CD 
  Offset 0D0:  61 ED 5A 79  4A 3F F7 B5  92 0F 69 5D  FB 78 77 F0 
  Offset 0E0:  00 00 00 00  00 00 00 00  00 00 00 00  00 00 00 00 
  Offset 0F0:  00 00 00 00  00 00 00 00  00 00 00 00  00 00 00 00 

B00 D1B F00: Intel Lynx Point-LP PCH - High Definition Audio Controller

  Offset 000:  86 80 20 9C  06 00 10 00  04 00 03 04  10 00 00 00 
  Offset 010:  04 80 D1 F7  00 00 00 00  00 00 00 00  00 00 00 00 
  Offset 020:  00 00 00 00  00 00 00 00  00 00 00 00  43 10 BD 13 
  Offset 030:  00 00 00 00  50 00 00 00  00 00 00 00  16 01 00 00 
  Offset 040:  03 00 04 3F  00 00 00 00  00 00 00 00  00 80 00 00 
  Offset 050:  01 60 43 C8  08 00 00 00  00 00 00 00  00 00 00 00 
  Offset 060:  05 70 80 00  00 00 00 00  00 00 00 00  00 00 00 00 
  Offset 070:  10 00 91 00  00 00 00 10  00 08 10 00  00 00 00 00 
  Offset 080:  00 00 00 00  00 00 00 00  00 00 00 00  00 00 00 00 
  Offset 090:  00 00 00 00  00 00 00 00  00 00 00 00  00 00 00 00 
  Offset 0A0:  00 00 00 00  00 00 00 00  00 00 00 00  00 00 00 00 
  Offset 0B0:  00 00 00 00  00 00 00 00  00 00 00 00  00 00 00 00 
  Offset 0C0:  00 04 02 01  00 60 00 01  00 0C 85 82  10 00 33 02 
  Offset 0D0:  00 0C 85 02  10 00 33 02  00 00 00 00  00 00 00 00 
  Offset 0E0:  00 00 00 00  00 00 00 00  00 00 00 00  00 00 00 00 
  Offset 0F0:  00 00 00 00  00 00 00 00  B1 0F 04 08  00 00 00 00 

B00 D1C F00: Intel Lynx Point-LP PCH - PCI Express Root Port 1

  Offset 000:  86 80 10 9C  04 00 10 00  E4 00 04 06  10 00 81 00 
  Offset 010:  00 00 00 00  00 00 00 00  00 01 01 00  F0 00 00 20 
  Offset 020:  F0 FF 00 00  F1 FF 01 00  00 00 00 00  00 00 00 00 
  Offset 030:  00 00 00 00  40 00 00 00  00 00 00 00  10 01 00 00 
  Offset 040:  10 80 42 00  00 80 00 00  00 00 10 00  12 4C 31 01 
  Offset 050:  03 00 01 10  60 00 04 00  00 00 40 00  00 00 00 00 
  Offset 060:  00 00 00 00  17 08 08 00  00 04 00 00  00 00 00 00 
  Offset 070:  02 00 01 00  00 00 00 00  00 00 00 00  00 00 00 00 
  Offset 080:  05 90 00 00  00 00 00 00  00 00 00 00  00 00 00 00 
  Offset 090:  0D A0 00 00  43 10 BD 13  00 00 00 00  00 00 00 00 
  Offset 0A0:  01 00 03 C8  08 00 00 00  00 00 00 00  00 00 00 00 
  Offset 0B0:  00 00 00 00  00 00 00 00  00 00 00 00  00 00 00 00 
  Offset 0C0:  00 00 00 00  00 00 00 00  00 00 00 00  00 00 00 00 
  Offset 0D0:  00 00 00 01  00 08 00 00  82 00 11 09  00 00 00 00 
  Offset 0E0:  06 7C 30 00  00 00 00 00  0A 00 00 00  00 00 00 00 
  Offset 0F0:  50 00 00 00  80 F5 00 00  B1 0F 04 08  05 28 C2 40 

B00 D1C F03: Intel Lynx Point-LP PCH - PCI Express Root Port 4

  Offset 000:  86 80 16 9C  06 00 10 00  E4 00 04 06  10 00 81 00 
  Offset 010:  00 00 00 00  00 00 00 00  00 02 02 00  F0 00 00 00 
  Offset 020:  C0 F7 C0 F7  F1 FF 01 00  00 00 00 00  00 00 00 00 
  Offset 030:  00 00 00 00  40 00 00 00  00 00 00 00  13 04 00 00 
  Offset 040:  10 80 42 01  00 80 00 00  00 00 11 00  12 3C 32 04 
  Offset 050:  42 00 11 70  00 B2 1C 00  00 00 40 01  00 00 00 00 
  Offset 060:  00 00 00 00  17 08 00 00  00 04 00 00  00 00 00 00 
  Offset 070:  02 00 01 00  00 00 00 00  00 00 00 00  00 00 00 00 
  Offset 080:  05 90 00 00  00 00 00 00  00 00 00 00  00 00 00 00 
  Offset 090:  0D A0 00 00  43 10 BD 13  00 00 00 00  00 00 00 00 
  Offset 0A0:  01 00 03 C8  08 00 00 00  00 00 00 00  00 00 00 00 
  Offset 0B0:  00 00 00 00  00 00 00 00  00 00 00 00  00 00 00 00 
  Offset 0C0:  00 00 00 00  00 00 00 00  00 00 00 00  00 00 00 00 
  Offset 0D0:  00 00 00 01  42 18 00 00  88 80 11 8B  00 00 00 00 
  Offset 0E0:  00 03 40 00  00 00 00 00  15 00 00 00  00 00 00 00 
  Offset 0F0:  50 00 00 00  40 00 00 0C  B1 0F 04 08  04 00 00 00 

B00 D1F F00: Intel Lynx Point-LP (Premium) - LPC Controller

  Offset 000:  86 80 43 9C  07 00 10 02  04 00 01 06  00 00 80 00 
  Offset 010:  00 00 00 00  00 00 00 00  00 00 00 00  00 00 00 00 
  Offset 020:  00 00 00 00  00 00 00 00  00 00 00 00  43 10 BD 13 
  Offset 030:  00 00 00 00  E0 00 00 00  00 00 00 00  00 00 00 00 
  Offset 040:  01 18 00 00  80 00 00 00  01 1C 00 00  10 00 00 00 
  Offset 050:  F8 00 00 00  00 00 00 00  00 00 00 00  00 00 00 00 
  Offset 060:  80 80 80 80  90 00 00 00  80 80 80 80  F8 F0 00 00 
  Offset 070:  78 F0 78 F0  78 F0 78 F0  78 F0 78 F0  78 F0 78 F0 
  Offset 080:  10 00 0F 3C  41 02 3C 00  00 00 00 00  00 00 00 00 
  Offset 090:  00 00 00 00  00 0F 00 00  00 00 00 00  00 00 00 00 
  Offset 0A0:  F4 1E A0 58  79 38 06 00  00 46 00 00  00 00 00 00 
  Offset 0B0:  00 00 00 00  00 00 00 00  00 00 00 00  00 00 00 00 
  Offset 0C0:  00 00 00 00  00 00 00 00  00 00 00 00  00 00 00 00 
  Offset 0D0:  33 22 11 00  67 45 00 00  CF FF 00 00  2A 00 00 00 
  Offset 0E0:  09 00 0C 10  00 00 00 00  11 A8 0E 94  00 00 00 00 
  Offset 0F0:  01 C0 D1 FE  00 00 00 00  B1 0F 04 08  00 00 00 00 

B00 D1F F02: Intel 82801HB(M) ICH8(M) - SATA RAID Controller

  Offset 000:  86 80 2A 28  07 04 B0 02  04 00 04 01  00 00 00 00 
  Offset 010:  B1 F0 00 00  A1 F0 00 00  91 F0 00 00  81 F0 00 00 
  Offset 020:  61 F0 00 00  00 20 D2 F7  00 00 00 00  43 10 BD 13 
  Offset 030:  00 00 00 00  80 00 00 00  00 00 00 00  00 02 00 00 
  Offset 040:  00 80 00 80  00 00 00 00  00 00 00 00  00 00 00 00 
  Offset 050:  00 00 00 00  00 00 00 00  00 00 00 00  00 00 00 00 
  Offset 060:  00 00 00 00  00 00 00 00  00 00 00 00  00 00 00 00 
  Offset 070:  01 A8 03 40  08 00 00 00  00 00 00 00  00 00 00 00 
  Offset 080:  05 70 01 00  38 01 E0 FE  00 00 00 00  00 00 00 00 
  Offset 090:  A0 0C 03 83  83 01 00 0C  20 02 DC 21  20 00 00 80 
  Offset 0A0:  A4 00 00 00  39 00 00 00  12 00 10 00  48 00 00 00 
  Offset 0B0:  00 00 00 00  00 00 00 00  00 00 00 00  00 00 00 00 
  Offset 0C0:  00 00 00 00  00 00 00 00  00 00 00 00  00 00 00 00 
  Offset 0D0:  00 00 00 00  00 00 00 00  00 00 00 00  00 00 00 00 
  Offset 0E0:  00 00 00 00  00 00 00 00  00 00 00 00  00 00 00 00 
  Offset 0F0:  00 00 00 00  00 00 00 00  B1 0F 04 08  00 00 00 00 

B00 D1F F03: Intel Lynx Point-LP PCH - SMBus Controller

  Offset 000:  86 80 22 9C  03 00 80 02  04 00 05 0C  00 00 00 00 
  Offset 010:  04 10 D2 F7  00 00 00 00  00 00 00 00  00 00 00 00 
  Offset 020:  41 F0 00 00  00 00 00 00  00 00 00 00  43 10 BD 13 
  Offset 030:  00 00 00 00  00 00 00 00  00 00 00 00  FF 03 00 00 
  Offset 040:  11 00 00 00  00 00 00 00  00 00 00 00  00 00 00 00 
  Offset 050:  00 00 00 00  00 00 00 00  00 00 00 00  00 00 00 00 
  Offset 060:  03 04 04 00  00 00 08 08  00 00 00 00  00 00 00 00 
  Offset 070:  00 00 00 00  00 00 00 00  00 00 00 00  00 00 00 00 
  Offset 080:  04 00 00 00  00 00 00 00  00 00 00 00  00 00 00 00 
  Offset 090:  00 00 00 00  00 00 00 00  00 00 00 00  00 00 00 00 
  Offset 0A0:  00 00 00 00  00 00 00 00  00 00 00 00  00 00 00 00 
  Offset 0B0:  00 00 00 00  00 00 00 00  00 00 00 00  00 00 00 00 
  Offset 0C0:  00 00 00 00  00 00 00 00  00 00 00 00  00 00 00 00 
  Offset 0D0:  00 00 00 00  00 00 00 00  00 00 00 00  00 00 00 00 
  Offset 0E0:  00 00 00 00  00 00 00 00  00 00 00 00  00 00 00 00 
  Offset 0F0:  00 00 00 00  00 00 00 00  B1 0F 04 08  00 00 00 00 

B00 D1F F06: Intel Lynx Point-LP PCH - Thermal Controller

  Offset 000:  86 80 24 9C  06 00 10 00  04 00 80 11  00 00 00 00 
  Offset 010:  04 00 D2 F7  00 00 00 00  00 00 00 00  00 00 00 00 
  Offset 020:  00 00 00 00  00 00 00 00  00 00 00 00  43 10 BD 13 
  Offset 030:  00 00 00 00  50 00 00 00  00 00 00 00  12 03 00 00 
  Offset 040:  05 F0 FD F7  00 00 00 00  00 00 00 00  00 00 00 00 
  Offset 050:  01 80 23 00  08 00 00 00  00 00 00 00  00 00 00 00 
  Offset 060:  00 00 00 00  00 00 00 00  00 00 00 00  00 00 00 00 
  Offset 070:  00 00 00 00  00 00 00 00  00 00 00 00  00 00 00 00 
  Offset 080:  05 00 00 00  00 00 00 00  00 00 00 00  00 00 00 00 
  Offset 090:  00 00 00 00  00 00 00 00  00 00 00 00  00 00 00 00 
  Offset 0A0:  00 00 00 00  00 00 00 00  00 00 00 00  00 00 00 00 
  Offset 0B0:  00 00 00 00  00 00 00 00  00 00 00 00  00 00 00 00 
  Offset 0C0:  00 00 00 00  00 00 00 00  00 00 00 00  00 00 00 00 
  Offset 0D0:  00 00 00 00  00 00 00 00  00 00 00 00  00 00 00 00 
  Offset 0E0:  00 00 00 00  00 00 00 00  00 00 00 00  00 00 00 00 
  Offset 0F0:  00 00 00 00  00 00 00 00  B1 0F 04 08  00 00 00 00 

B02 D00 F00: Intel Dual Band Wireless-AC 7260 AC 2x2 HMC WiFi Adapter

  Offset 000:  86 80 B1 08  06 04 10 00  6B 00 80 02  10 00 00 00 
  Offset 010:  04 00 C0 F7  00 00 00 00  00 00 00 00  00 00 00 00 
  Offset 020:  00 00 00 00  00 00 00 00  00 00 00 00  86 80 70 C0 
  Offset 030:  00 00 00 00  C8 00 00 00  00 00 00 00  00 01 00 00 
  Offset 040:  10 00 02 00  C0 8E 00 10  10 0C 11 00  11 EC 06 00 
  Offset 050:  42 01 11 10  00 00 00 00  00 00 00 00  00 00 00 00 
  Offset 060:  00 00 00 00  12 08 08 00  05 04 00 00  00 00 00 00 
  Offset 070:  01 00 01 00  00 00 00 00  00 00 00 00  00 00 00 00 
  Offset 080:  00 00 00 00  00 00 00 00  00 00 00 00  00 00 00 00 
  Offset 090:  00 00 00 00  00 00 00 00  00 00 00 00  00 00 00 00 
  Offset 0A0:  00 00 00 00  00 00 00 00  00 00 00 00  00 00 00 00 
  Offset 0B0:  00 00 00 00  00 00 00 00  00 00 00 00  00 00 00 00 
  Offset 0C0:  00 00 00 00  00 00 00 00  01 D0 23 C8  00 00 00 0D 
  Offset 0D0:  05 40 81 00  B8 01 E0 FE  00 00 00 00  00 00 00 00 
  Offset 0E0:  00 00 00 00  00 00 00 00  00 00 00 00  00 00 00 00 
  Offset 0F0:  00 00 00 00  00 00 00 00  00 00 00 00  00 00 00 00 

